{
  "schema_version": 1,
  "kind": "inference",
  "workload": "W8",
  "commit": "0000000000000000000000000000000000000000",
  "toolchain": "synthetic test toolchain",
  "device": "synthetic CPU",
  "driver": "not-applicable",
  "model_config": {"name": "synthetic schema fixture"},
  "plan_digest": "0000000000000000000000000000000000000000000000000000000000000000",
  "profile": "standard",
  "bindings_all_on": true,
  "batch_size": 1,
  "prompt_tokens": 2,
  "generated_tokens": 1,
  "prover_time_ns": 100,
  "witness_recompute_ns": 20,
  "stage_times_ns": {"synthetic_stage": 80},
  "kernel_counters": {"synthetic_counter": 1},
  "proof_size_bytes": 64,
  "verifier_time_ns": {"rust": 10, "python": 20},
  "controls": {"total": 1, "passed": 1, "failed": 0},
  "note": "Synthetic schema fixture only; not a benchmark measurement."
}
